{
  "$schema": "./schemas/provider-manifest.schema.json",
  "schemaVersion": "0.2",
  "manifestDigestAlgorithm": "sha256-canonical-json-excluding-manifest-digest-v1",
  "manifestSha256": "7b420d7b1ff89248be186525cb6da9cb038a29b16dcb4d5339a68ce5f0e615d1",
  "project": "qxnm-forge",
  "author": {
    "name": "高宏顺",
    "email": "18272669457@163.com"
  },
  "reference": {
    "project": "PI",
    "commit": "3f9aa5d10b35223abf6146f960ff5cb5c68053ee",
    "license": "MIT"
  },
  "textApiFamilies": [
    "openai-completions",
    "mistral-conversations",
    "openai-responses",
    "azure-openai-responses",
    "openai-codex-responses",
    "anthropic-messages",
    "bedrock-converse-stream",
    "google-generative-ai",
    "google-vertex"
  ],
  "imageApiFamilies": [
    "openrouter-images"
  ],
  "adapters": [
    {
      "id": "openai-completions-v1",
      "apiFamily": "openai-completions"
    },
    {
      "id": "mistral-conversations-v1",
      "apiFamily": "mistral-conversations"
    },
    {
      "id": "openai-responses-v1",
      "apiFamily": "openai-responses"
    },
    {
      "id": "azure-openai-responses-v1",
      "apiFamily": "azure-openai-responses"
    },
    {
      "id": "openai-codex-responses-v1",
      "apiFamily": "openai-codex-responses"
    },
    {
      "id": "anthropic-messages-v1",
      "apiFamily": "anthropic-messages"
    },
    {
      "id": "bedrock-converse-stream-v1",
      "apiFamily": "bedrock-converse-stream"
    },
    {
      "id": "google-generative-ai-v1",
      "apiFamily": "google-generative-ai"
    },
    {
      "id": "google-vertex-v1",
      "apiFamily": "google-vertex"
    },
    {
      "id": "openrouter-images-v1",
      "apiFamily": "openrouter-images"
    }
  ],
  "modelCatalogs": [
    {
      "id": "pi-v1-frozen",
      "path": "./models.v1.json",
      "sourceCommit": "3f9aa5d10b35223abf6146f960ff5cb5c68053ee"
    }
  ],
  "headerPolicies": [
    {
      "id": "api-family-default",
      "credentialPlacement": "api-family",
      "fixedHeaders": "none"
    },
    {
      "id": "api-family-default-with-model-headers",
      "credentialPlacement": "api-family",
      "fixedHeaders": "model-catalog"
    },
    {
      "id": "cloudflare-ai-gateway",
      "credentialPlacement": "cloudflare-aig-authorization",
      "fixedHeaders": "none"
    }
  ],
  "providers": [
    {
      "id": "amazon-bedrock",
      "environment": [
        {
          "name": "AWS_ACCESS_KEY_ID",
          "role": "secret"
        },
        {
          "name": "AWS_BEARER_TOKEN_BEDROCK",
          "role": "secret"
        },
        {
          "name": "AWS_CONTAINER_CREDENTIALS_FULL_URI",
          "role": "credential-endpoint"
        },
        {
          "name": "AWS_CONTAINER_CREDENTIALS_RELATIVE_URI",
          "role": "credential-endpoint"
        },
        {
          "name": "AWS_DEFAULT_REGION",
          "role": "configuration"
        },
        {
          "name": "AWS_PROFILE",
          "role": "credential-selector"
        },
        {
          "name": "AWS_REGION",
          "role": "configuration"
        },
        {
          "name": "AWS_SECRET_ACCESS_KEY",
          "role": "secret"
        },
        {
          "name": "AWS_SESSION_TOKEN",
          "role": "secret"
        },
        {
          "name": "AWS_WEB_IDENTITY_TOKEN_FILE",
          "role": "credential-file"
        }
      ],
      "authProfiles": [
        {
          "id": "aws-default-chain",
          "kind": "aws-credential-chain",
          "environment": [
            "AWS_ACCESS_KEY_ID",
            "AWS_BEARER_TOKEN_BEDROCK",
            "AWS_CONTAINER_CREDENTIALS_FULL_URI",
            "AWS_CONTAINER_CREDENTIALS_RELATIVE_URI",
            "AWS_PROFILE",
            "AWS_SECRET_ACCESS_KEY",
            "AWS_SESSION_TOKEN",
            "AWS_WEB_IDENTITY_TOKEN_FILE"
          ]
        }
      ],
      "routes": [
        {
          "media": "text",
          "apiFamily": "bedrock-converse-stream",
          "adapterId": "bedrock-converse-stream-v1",
          "modelCatalogId": "pi-v1-frozen",
          "endpoint": {
            "source": "model-catalog",
            "templateBindings": [],
            "runtimeEndpointEnv": [
              "AWS_DEFAULT_REGION",
              "AWS_REGION"
            ],
            "runtimeOverride": "explicit-configuration-only"
          },
          "authProfileIds": [
            "aws-default-chain"
          ],
          "headerPolicyId": "api-family-default",
          "quirks": []
        }
      ]
    },
    {
      "id": "ant-ling",
      "environment": [
        {
          "name": "ANT_LING_API_KEY",
          "role": "secret"
        }
      ],
      "authProfiles": [
        {
          "id": "api-key",
          "kind": "api-key",
          "environment": [
            "ANT_LING_API_KEY"
          ]
        }
      ],
      "routes": [
        {
          "media": "text",
          "apiFamily": "openai-completions",
          "adapterId": "openai-completions-v1",
          "modelCatalogId": "pi-v1-frozen",
          "endpoint": {
            "source": "model-catalog",
            "templateBindings": [],
            "runtimeEndpointEnv": [],
            "runtimeOverride": "explicit-configuration-only"
          },
          "authProfileIds": [
            "api-key"
          ],
          "headerPolicyId": "api-family-default",
          "quirks": [
            "maxTokensField",
            "supportsDeveloperRole",
            "supportsLongCacheRetention",
            "supportsReasoningEffort",
            "supportsStore",
            "thinkingFormat"
          ]
        }
      ]
    },
    {
      "id": "anthropic",
      "environment": [
        {
          "name": "ANTHROPIC_API_KEY",
          "role": "secret"
        },
        {
          "name": "ANTHROPIC_OAUTH_TOKEN",
          "role": "secret"
        }
      ],
      "authProfiles": [
        {
          "id": "environment-token",
          "kind": "api-key",
          "environment": [
            "ANTHROPIC_OAUTH_TOKEN",
            "ANTHROPIC_API_KEY"
          ]
        },
        {
          "id": "interactive-oauth",
          "kind": "oauth",
          "environment": []
        }
      ],
      "routes": [
        {
          "media": "text",
          "apiFamily": "anthropic-messages",
          "adapterId": "anthropic-messages-v1",
          "modelCatalogId": "pi-v1-frozen",
          "endpoint": {
            "source": "model-catalog",
            "templateBindings": [],
            "runtimeEndpointEnv": [],
            "runtimeOverride": "explicit-configuration-only"
          },
          "authProfileIds": [
            "environment-token",
            "interactive-oauth"
          ],
          "headerPolicyId": "api-family-default",
          "quirks": [
            "forceAdaptiveThinking",
            "supportsTemperature"
          ]
        }
      ]
    },
    {
      "id": "azure-openai-responses",
      "environment": [
        {
          "name": "AZURE_OPENAI_API_KEY",
          "role": "secret"
        },
        {
          "name": "AZURE_OPENAI_API_VERSION",
          "role": "configuration"
        },
        {
          "name": "AZURE_OPENAI_BASE_URL",
          "role": "configuration"
        },
        {
          "name": "AZURE_OPENAI_DEPLOYMENT_NAME_MAP",
          "role": "configuration"
        },
        {
          "name": "AZURE_OPENAI_RESOURCE_NAME",
          "role": "configuration"
        }
      ],
      "authProfiles": [
        {
          "id": "api-key",
          "kind": "api-key",
          "environment": [
            "AZURE_OPENAI_API_KEY"
          ]
        }
      ],
      "routes": [
        {
          "media": "text",
          "apiFamily": "azure-openai-responses",
          "adapterId": "azure-openai-responses-v1",
          "modelCatalogId": "pi-v1-frozen",
          "endpoint": {
            "source": "model-catalog",
            "templateBindings": [],
            "runtimeEndpointEnv": [
              "AZURE_OPENAI_BASE_URL",
              "AZURE_OPENAI_RESOURCE_NAME"
            ],
            "runtimeOverride": "explicit-configuration-only"
          },
          "authProfileIds": [
            "api-key"
          ],
          "headerPolicyId": "api-family-default",
          "quirks": []
        }
      ]
    },
    {
      "id": "cerebras",
      "environment": [
        {
          "name": "CEREBRAS_API_KEY",
          "role": "secret"
        }
      ],
      "authProfiles": [
        {
          "id": "api-key",
          "kind": "api-key",
          "environment": [
            "CEREBRAS_API_KEY"
          ]
        }
      ],
      "routes": [
        {
          "media": "text",
          "apiFamily": "openai-completions",
          "adapterId": "openai-completions-v1",
          "modelCatalogId": "pi-v1-frozen",
          "endpoint": {
            "source": "model-catalog",
            "templateBindings": [],
            "runtimeEndpointEnv": [],
            "runtimeOverride": "explicit-configuration-only"
          },
          "authProfileIds": [
            "api-key"
          ],
          "headerPolicyId": "api-family-default",
          "quirks": [
            "supportsDeveloperRole",
            "supportsStore"
          ]
        }
      ]
    },
    {
      "id": "cloudflare-ai-gateway",
      "environment": [
        {
          "name": "CLOUDFLARE_ACCOUNT_ID",
          "role": "configuration"
        },
        {
          "name": "CLOUDFLARE_API_KEY",
          "role": "secret"
        },
        {
          "name": "CLOUDFLARE_GATEWAY_ID",
          "role": "configuration"
        }
      ],
      "authProfiles": [
        {
          "id": "cloudflare-token",
          "kind": "cloudflare-token",
          "environment": [
            "CLOUDFLARE_API_KEY",
            "CLOUDFLARE_ACCOUNT_ID",
            "CLOUDFLARE_GATEWAY_ID"
          ]
        }
      ],
      "routes": [
        {